{
  "$schema": "https://json-schema.org/draft/2020-12/schema",
  "$id": "https://github.com/gregmos/memoforge/schemas/source-pack.schema.json",
  "title": "memoforge research/source-pack.json",
  "description": "Frozen snapshot published by `mf sources pack --freeze` in one transaction; after the freeze, lint, citation audit and rendering read only this file (TZ v1.5 §5.3, M6).",
  "type": "object",
  "required": ["schema_version", "frozen_at", "snapshot", "entries"],
  "additionalProperties": false,
  "properties": {
    "schema_version": { "type": "integer", "minimum": 2 },
    "frozen_at": { "$ref": "#/$defs/timestamp" },
    "snapshot": {
      "description": "The {source_id, raw_sha256} list pinned by the freeze; C-02 requires triple sha equality against it.",
      "type": "array",
      "items": { "$ref": "#/$defs/snapshot_entry" }
    },
    "entries": {
      "type": "array",
      "items": { "$ref": "#/$defs/entry" }
    },
    "merged_into": {
      "description": "D34-04: `{dropped_source_id: canonical_source_id}` for the duplicate groups the freeze collapsed. Absent when nothing was merged; dropped ids have no entry and no snapshot row.",
      "type": "object",
      "propertyNames": { "$ref": "#/$defs/source_id" },
      "additionalProperties": { "$ref": "#/$defs/source_id" }
    },
    "integrity_warnings": {
      "description": "D-200 fix round 2: the freeze demotions of code-saved text, so the evidence survives interruption and replay. Absent when the freeze demoted nothing; an old pack without it keeps validating.",
      "type": "array",
      "items": { "$ref": "#/$defs/integrity_warning" }
    }
  },
  "$defs": {
    "source_id": {
      "type": "string",
      "minLength": 1,
      "maxLength": 80,
      "pattern": "^[a-z0-9][a-z0-9._-]*$"
    },
    "issue_id": {
      "type": "string",
      "minLength": 1,
      "maxLength": 64,
      "pattern": "^[A-Za-z0-9][A-Za-z0-9._-]*$"
    },
    "sha256": { "type": "string", "pattern": "^[0-9a-f]{64}$" },
    "timestamp": {
      "type": "string",
      "pattern": "^[0-9]{4}-[0-9]{2}-[0-9]{2}T[0-9]{2}:[0-9]{2}:[0-9]{2}([.][0-9]+)?(Z|[+-][0-9]{2}:[0-9]{2})$"
    },
    "identifiers": {
      "type": "object",
      "additionalProperties": false,
      "properties": {
        "celex": { "type": "string", "minLength": 1 },
        "ecli": { "type": "string", "minLength": 1 },
        "eli": { "type": "string", "minLength": 1 },
        "reporter_cite": { "type": "string", "minLength": 1 },
        "neutral": { "type": "string", "minLength": 1 }
      }
    },
    "snapshot_entry": {
      "type": "object",
      "required": ["source_id", "raw_sha256"],
      "additionalProperties": false,
      "properties": {
        "source_id": { "$ref": "#/$defs/source_id" },
        "raw_sha256": {
          "anyOf": [{ "type": "null" }, { "$ref": "#/$defs/sha256" }]
        },
        "raw_original_sha256": {
          "description": "D-201: sha256 of the original file the record kept (a PDF), recomputed from disk by the freeze. Absent when the record has no original or the file is gone; an old pack without the field keeps validating.",
          "$ref": "#/$defs/sha256"
        }
      }
    },
    "integrity_warning": {
      "description": "D-200 fix round 2: one integrity finding of the freeze. Two shapes and no others: a demotion of code-saved text, or — D-201 — a record that is not `full_text` whose original changed or vanished, which is said out loud but never demoted, so its kind is reported unchanged.",
      "type": "object",
      "required": ["code", "source_id", "was", "now"],
      "additionalProperties": false,
      "properties": {
        "code": { "const": "full_text_integrity" },
        "source_id": { "$ref": "#/$defs/source_id" },
        "was": { "$ref": "#/$defs/raw_kind" },
        "now": { "$ref": "#/$defs/raw_kind" }
      },
      "anyOf": [
        {
          "description": "The demotion of D-200: only `full_text` is ever demoted, and only downwards.",
          "properties": { "was": { "const": "full_text" }, "now": { "enum": ["agent_summary", "none"] } }
        },
        {
          "description": "D-201: nothing to demote, so `was` and `now` are the same non-`full_text` kind.",
          "properties": { "was": { "const": "excerpt" }, "now": { "const": "excerpt" } }
        },
        { "properties": { "was": { "const": "agent_summary" }, "now": { "const": "agent_summary" } } },
        { "properties": { "was": { "const": "client_file" }, "now": { "const": "client_file" } } },
        { "properties": { "was": { "const": "none" }, "now": { "const": "none" } } }
      ]
    },
    "raw_kind": {
      "description": "D-200: what a saved text is.",
      "enum": ["full_text", "excerpt", "agent_summary", "client_file", "none"]
    },
    "pack": {
      "type": "object",
      "required": ["role_by_issue", "weight", "confidence", "use_in_memo"],
      "additionalProperties": false,
      "properties": {
        "role_by_issue": {
          "type": "object",
          "propertyNames": { "$ref": "#/$defs/issue_id" },
          "additionalProperties": {
            "enum": ["rule", "application", "risk", "background", "contrary"]
          }
        },
        "weight": { "enum": ["binding", "persuasive", "non_binding"] },
        "confidence": { "enum": ["high", "medium", "low"] },
        "use_in_memo": { "enum": ["rule", "application", "risk", "background", "do_not_use"] }
      }
    },
    "entry": {
      "description": "Citation-ready projection of a registry record; the docx renderer builds OSCOLA forms from these fields.",
      "type": "object",
      "required": ["source_id", "layer", "title", "citation_form", "url", "tier", "currency_status", "pack"],
      "additionalProperties": false,
      "properties": {
        "source_id": { "$ref": "#/$defs/source_id" },
        "layer": { "enum": ["statutes", "case_law", "doctrine"] },
        "title": { "type": "string", "minLength": 1 },
        "citation_form": { "type": "string", "minLength": 1 },
        "identifiers": { "$ref": "#/$defs/identifiers" },
        "url": {
          "description": "Copied verbatim from the registry; empty for a citation-only source.",
          "type": "string"
        },
        "retrieved_from": {
          "description": "D-192: the MCP endpoint address behind a source with no public url. Optional; the renderer reads it only to name the database in the Sources annex.",
          "type": "string"
        },
        "retrieved_at": { "$ref": "#/$defs/timestamp" },
        "tier": { "enum": ["critical", "supporting", "background"] },
        "raw_kind": {
          "description": "D-200: what the saved text is, recorded after the freeze integrity check. Optional; after the freeze the entry is authoritative, and an old frozen pack without the field keeps validating.",
          "enum": ["full_text", "excerpt", "agent_summary", "client_file", "none"]
        },
        "currency_status": {
          "enum": ["current", "outdated_but_usable", "do_not_use", "manual_check", "unchecked"]
        },
        "verification_us": { "enum": ["resolved", "unresolved", "ambiguous", "n/a"] },
        "pack": { "$ref": "#/$defs/pack" }
      }
    }
  }
}
